{
  "step_id": "step-s4-execute-001",
  "step_type": "execute_taskspec",
  "status": "step_success_continue",
  "transport_status": "success",
  "business_decision": "accepted",
  "dispatch_status": "dispatched",
  "produced_files": ["_reports/evidence/pack.zip", "_reports/FLOW_OUTCOME.json"],
  "next_action": "Run S5 TaskSpec",
  "terminal": false,
  "errors": [],
  "safety": {
    "high_risk_action_attempted": false,
    "human_confirmed": false,
    "forbidden_action_blocked": false,
    "schema_validated": true
  },
  "reason": "S4 executed successfully, S5 TaskSpec ready"
}
